module,skill,display-name,menu-code,description,action,args,phase,after,before,required,output-location,outputs
Auspex,ausx-setup,Configure Auspex,AX,"Install or update Auspex module config and help entries.",configure,"{-H: headless mode}|{inline config values}",anytime,,ausx-map-audit:audit,false,{project-root}/_bmad,config and help entries
Auspex,ausx-map-audit,Audit Governance Map,MA,"Validate stable IDs, parent references, orphans, broken links, and projection rebuild readiness.",audit,"{-H: headless mode}|{path: project root or docs root}|{--html: HTML-capable report}",1-audit,ausx-setup:configure,ausx-ledger-promotion:promote,true,reporting_output_path,map audit findings report
Auspex,ausx-ledger-promotion,Promote Ledger Knowledge,LP,"Promote completed feature knowledge into living service/domain/program ledgers.",promote,"{-H: headless mode}|{feature path or scope}|{--apply: write approved ledger updates}",2-promotion,ausx-map-audit:audit,ausx-salmon-impact:review,false,reporting_output_path,ledger promotion report and optional ledger updates
Auspex,ausx-salmon-impact,Review Salmon Impact,SI,"Trace upstream-impact signals and classify recursive consistency risk.",review,"{-H: headless mode}|{origin artifact or scope}",3-impact,ausx-ledger-promotion:promote,ausx-topology-design:design,false,reporting_output_path,Salmon impact report
Auspex,ausx-topology-design,Design Topology,TD,"Create or update service/domain/program topology decisions from project evidence.",design,"{-H: headless mode}|{project context or scope}|{--apply: write approved ledger scaffolds}",4-topology,ausx-salmon-impact:review,ausx-reporting-snapshot:snapshot,false,reporting_output_path,topology decision report
Auspex,ausx-reporting-snapshot,Create Reporting Snapshot,RS,"Produce read-only stakeholder status snapshots from feature, archive, ledger, and report artifacts.",snapshot,"{-H: headless mode}|{scope}|{--format markdown,json}",5-reporting,ausx-topology-design:design,,false,reporting_output_path,Markdown and JSON status snapshot

